id,target_text,whisper_text,wer,substitutions,deletions,insertions,hits,audio_duration_s,latency_s,is_success,error
common_voice_en_26645969-common_voice_en_26645970,The creation of a Supreme Court was unique in the case of South Australia.,The creation of a supreme court was unique in the case of South Australia.,0.000000,0,0,0,14,6.2773,0.0000,True,
common_voice_en_26933529-common_voice_en_26933531,"Mike Dimkich is indeed helping us out right now, and we are genuinely appreciative.","Mike Timkish is indeed helping us out right now, and we are genuinely appreciative.",0.071429,1,0,0,13,5.2907,0.0000,True,
common_voice_en_26933529-common_voice_en_26933532,"Mike Dimkich is indeed helping us out right now, and we are genuinely appreciative.","Mike Timkis is indeed helping us out right now, and we are genuinely appreciative.",0.071429,1,0,0,13,5.2907,0.0000,True,
common_voice_en_26952530-common_voice_en_26952588,"It is well connected by road and rail to Bangalore, Mangalore and Mysore.","It is well connected by road and rail to Bangalore, Mangalore, and Mysore.",0.000000,0,0,0,13,4.2240,0.0000,True,
common_voice_en_26952530-common_voice_en_26952634,"It is well connected by road and rail to Bangalore, Mangalore and Mysore.","It is well connected by road and rail to Bangalore, Mangalore, and Mysore.",0.000000,0,0,0,13,4.2240,0.0000,True,
common_voice_en_26953128-common_voice_en_26953126,"Brooks advocates ""growing"" software organically through incremental development.",Brooks advocates growing software organically through incremental development.,0.000000,0,0,0,8,5.6798,0.0000,True,
common_voice_en_26953128-common_voice_en_26953130,"Brooks advocates ""growing"" software organically through incremental development.",Brooks advocates growing software organically through incremental development.,0.000000,0,0,0,8,5.6798,0.0000,True,
common_voice_en_27015814-common_voice_en_27015815,"Spring described the offer as ""irresistible"" and the appointment proved very successful.","Spring described the offer as irresistible, and the appointment proved very successful.",0.000000,0,0,0,12,5.2693,0.0000,True,
common_voice_en_27099623-common_voice_en_27099624,It has five mountain ranges and nineteen peaks.,It has five mountain ranges and nineteen peaks.,0.000000,0,0,0,8,4.2080,0.0000,True,
common_voice_en_27099623-common_voice_en_27099625,It has five mountain ranges and nineteen peaks.,It has five mountain ranges and nineteen peaks.,0.000000,0,0,0,8,4.2080,0.0000,True,
common_voice_en_27172977-common_voice_en_27172978,He concluded This is a game best played with the voices turned off.,"He concluded: ""This is a game best played with the voices turned off.""",0.000000,0,0,0,13,3.9016,0.0000,True,
common_voice_en_27172977-common_voice_en_27172980,He concluded This is a game best played with the voices turned off.,"He concluded, ""This is a game best played with the voices turned off.""",0.000000,0,0,0,13,3.9016,0.0000,True,
common_voice_en_27383934-common_voice_en_27383932,"A more structured format of this model is of course objects, or classes.","A more structured format of this model is, of course, objects or classes.",0.000000,0,0,0,13,4.1973,0.0000,True,
common_voice_en_27383934-common_voice_en_27383936,"A more structured format of this model is of course objects, or classes.","A more structured format of this model is, of course, objects or classes.",0.000000,0,0,0,13,4.1973,0.0000,True,
common_voice_en_27389507-common_voice_en_27389508,"Once the remodeling was finished, the Department of Business Administration moved in.","Once the remodeling was finished, the Department of Business Administration moved in.",0.000000,0,0,0,12,5.8507,0.0000,True,
common_voice_en_27389507-common_voice_en_27389509,"Once the remodeling was finished, the Department of Business Administration moved in.","Once the remodeling was finished, the Department of Business Administration moved in.",0.000000,0,0,0,12,5.8507,0.0000,True,
common_voice_en_27404277-common_voice_en_27404276,"The trolleys operate continuously, reversing direction via loops at the ends of the line.","The trolleys operate continuously, reversing direction via loops at the ends of the line.",0.000000,0,0,0,14,5.4773,0.0000,True,
common_voice_en_27434681-common_voice_en_27434683,The unincorporated community of Calumetville is located partially in the town.,The unincorporated community of Colimentville is located partially in the town.,0.090909,1,0,0,10,5.9467,0.0000,True,
common_voice_en_27434681-common_voice_en_27434685,The unincorporated community of Calumetville is located partially in the town.,The unincorporated community of Colometville is located partially in the town.,0.090909,1,0,0,10,5.9467,0.0000,True,
common_voice_en_27474919-common_voice_en_27474918,The player clears the game by reaching the final level of the mode.,The player clears the game by reaching the final level of the mode.,0.000000,0,0,0,13,3.0827,0.0000,True,
common_voice_en_27474919-common_voice_en_27474920,The player clears the game by reaching the final level of the mode.,The player clears the game by reaching the final level of the mode.,0.000000,0,0,0,13,3.0827,0.0000,True,
common_voice_en_27501458-common_voice_en_27501460,Thus the electrostatic potential energy of the charge will increase.,"Thus, the electrostatic potential energy of the charge will increase.",0.000000,0,0,0,10,5.5253,0.0000,True,
common_voice_en_275174-common_voice_en_275175,His shirt was clean but one button was gone.,"His shirt was clean, but one button was gone.",0.000000,0,0,0,9,3.5520,0.0000,True,
common_voice_en_27573778-common_voice_en_27573779,Gandhi feared that the movement might lead to popular violence.,Gandhi feared that the movement might lead to popular violence.,0.000000,0,0,0,10,3.7236,0.0000,True,
common_voice_en_27573778-common_voice_en_27573780,Gandhi feared that the movement might lead to popular violence.,Gandhi feared that the movement might lead to popular violence.,0.000000,0,0,0,10,3.7236,0.0000,True,
common_voice_en_27585762-common_voice_en_27585765,The missiles were fired at both military and civilian targets.,The missiles were fired at both military and civilian targets.,0.000000,0,0,0,10,4.2240,0.0000,True,
common_voice_en_27612070-common_voice_en_27612071,His Concerned Citizens ticket won three of the four seats on the city council.,His Concerned Citizens' ticket won three of the four seats on the City Council.,0.000000,0,0,0,14,4.6400,0.0000,True,
common_voice_en_27733062-common_voice_en_27733063,"Without letters patent, a person is unable to assume an appointed office.","Without letter's patent, a person is unable to assume an appointed office.",0.166667,1,0,1,11,5.5093,0.0000,True,
common_voice_en_27733062-common_voice_en_27733065,"Without letters patent, a person is unable to assume an appointed office.","Without letters patent, a person is unable to assume an appointed office.",0.000000,0,0,0,12,5.5093,0.0000,True,
common_voice_en_27794266-common_voice_en_27794264,The decision to merge or not is decided using pre-configured policies.,The decision to merge or not is decided using pre-configured policies.,0.000000,0,0,0,12,4.2027,0.0000,True,
common_voice_en_27794266-common_voice_en_27794265,The decision to merge or not is decided using pre-configured policies.,The decision to merge or not is decided using pre-configured policies.,0.000000,0,0,0,12,4.2027,0.0000,True,
common_voice_en_27856404-common_voice_en_27856406,He had heard of the cavalry skirmish the day before the battle.,He had heard of the cavalry skirmish the day before the battle.,0.000000,0,0,0,12,3.6320,0.0000,True,
common_voice_en_27935469-common_voice_en_27935466,It received positive responses from both viewers and critics.,It received positive responses from both viewers and critics.,0.000000,0,0,0,9,4.8320,0.0000,True,
common_voice_en_27935469-common_voice_en_27935467,It received positive responses from both viewers and critics.,It received positive responses from both viewers and critics.,0.000000,0,0,0,9,4.8320,0.0000,True,
common_voice_en_28003405-common_voice_en_28003408,"The Kingdom was in an economic depression, with the whaling industry rapidly declining.","The kingdom was in an economic depression, with the whaling industry rapidly declining.",0.000000,0,0,0,13,5.4240,0.0000,True,
common_voice_en_28003405-common_voice_en_28003409,"The Kingdom was in an economic depression, with the whaling industry rapidly declining.","The kingdom was in an economic depression, with the whaling industry rapidly declining.",0.000000,0,0,0,13,5.4240,0.0000,True,
common_voice_en_28064064-common_voice_en_28064058,The blueprints for the new airport and container port had already been drawn.,The blueprints for the new airport and container port had already been drawn.,0.000000,0,0,0,13,4.2933,0.0000,True,
common_voice_en_28064064-common_voice_en_28064066,The blueprints for the new airport and container port had already been drawn.,The blueprints for the new airport and container port had already been drawn.,0.000000,0,0,0,13,4.2933,0.0000,True,
common_voice_en_28065832-common_voice_en_28065833,A normal school department taught teachers.,A normal school department taught teachers.,0.000000,0,0,0,6,3.1795,0.0000,True,
common_voice_en_28132727-common_voice_en_28132728,Anybody from the community has the potential to become a role model.,Anybody from the community has the potential to become a role model.,0.000000,0,0,0,12,3.9467,0.0000,True,
common_voice_en_28243259-common_voice_en_28243258,A number of services are provided by other local agencies.,A number of services are provided by other local agencies.,0.000000,0,0,0,10,3.2267,0.0000,True,
common_voice_en_28316626-common_voice_en_28316627,While in this capacity Roland was promoted to commander.,"While in this capacity, Roland was promoted to commander.",0.000000,0,0,0,9,3.7600,0.0000,True,
common_voice_en_28316626-common_voice_en_28316630,While in this capacity Roland was promoted to commander.,"While in this capacity, Roland was promoted to commander.",0.000000,0,0,0,9,3.7600,0.0000,True,
common_voice_en_28485171-common_voice_en_28485174,This was the first major battle of the Gallic Wars.,This was the first major battle of the Gallic Wars.,0.000000,0,0,0,10,3.1051,0.0000,True,
common_voice_en_28638628-common_voice_en_28638714,The borders of the municipality have not changed since that time.,The borders of the municipality have not changed since that time.,0.000000,0,0,0,11,4.4853,0.0000,True,
common_voice_en_28638628-common_voice_en_28638717,The borders of the municipality have not changed since that time.,The borders of the municipality have not changed since that time.,0.000000,0,0,0,11,4.4853,0.0000,True,
common_voice_en_28717453-common_voice_en_28717454,The strain of playing almost constantly took a physical toll on Casals.,The strain of playing almost constantly took a physical toll on Castles.,0.083333,1,0,0,11,4.5653,0.0000,True,
common_voice_en_28717453-common_voice_en_28717472,The strain of playing almost constantly took a physical toll on Casals.,The strain of playing almost constantly took a physical toll on Castles.,0.083333,1,0,0,11,4.5653,0.0000,True,
common_voice_en_28827679-common_voice_en_28827680,"Lewis, however, was having a personal crisis and the manuscript was abandoned.","Lewis, however, was having a personal crisis, and the manuscript was abandoned.",0.000000,0,0,0,12,4.8427,0.0000,True,
common_voice_en_28827679-common_voice_en_28827709,"Lewis, however, was having a personal crisis and the manuscript was abandoned.","Lewis, however, was having a personal crisis, and the manuscript was abandoned.",0.000000,0,0,0,12,4.8427,0.0000,True,
common_voice_en_28884498-common_voice_en_28884499,Nowadays Christians frown on drunks and prostitutes.,"Nowadays, Christians frown on drunks and prostitutes.",0.000000,0,0,0,7,3.8133,0.0000,True,
common_voice_en_28884498-common_voice_en_28884500,Nowadays Christians frown on drunks and prostitutes.,"Nowadays, Christians frown on drunks and prostitutes.",0.000000,0,0,0,7,3.8133,0.0000,True,
common_voice_en_28894436-common_voice_en_28894442,"It hired a new program director and morning show host, Doc Washburn.","It hired a new program director and morning show host, Doc Washburn.",0.000000,0,0,0,12,5.3375,0.0000,True,
common_voice_en_28917649-common_voice_en_28917648,"However, horses that could not be controlled had to be destroyed.","However, horses that could not be controlled had to be destroyed.",0.000000,0,0,0,11,3.7013,0.0000,True,
common_voice_en_28917649-common_voice_en_28917650,"However, horses that could not be controlled had to be destroyed.","However, horses that could not be controlled had to be destroyed.",0.000000,0,0,0,11,3.7013,0.0000,True,
common_voice_en_28919201-common_voice_en_28919202,"Many, though not all of these have first syllables that evolved from Latin.","Many, though not all, of these have first syllables that evolved from Latin.",0.000000,0,0,0,13,4.8853,0.0000,True,
common_voice_en_28932865-common_voice_en_28932866,"""Victoria"" will be used for training purposes until repairs are effected.",Victoria will be used for training purposes until repairs are effected.,0.000000,0,0,0,11,4.0533,0.0000,True,
common_voice_en_28932865-common_voice_en_28932867,"""Victoria"" will be used for training purposes until repairs are effected.",Victoria will be used for training purposes until repairs are effected.,0.000000,0,0,0,11,4.0533,0.0000,True,
common_voice_en_29264353-common_voice_en_29264354,Subsystem failure rate budgets are assigned so that hazard probability limits can be met.,Subsystem failure rate budgets are assigned so that hazard probability limits can be met.,0.000000,0,0,0,14,4.4640,0.0000,True,
common_voice_en_29345455-common_voice_en_29345456,Systems using artificial neural networks have been used to great effect.,Systems using artificial neural networks have been used to great effect.,0.000000,0,0,0,11,4.2827,0.0000,True,
common_voice_en_29495818-common_voice_en_29495898,The emblem of the merged organization combines elements of both predecessors.,The emblem of the merged organizations combines elements above predecessors.,0.272727,2,1,0,8,5.2000,0.0000,True,
common_voice_en_29890305-common_voice_en_29890301,Such calls are classified as failed call attempts.,Such calls are classified as failed call attempts.,0.000000,0,0,0,8,3.4400,0.0000,True,
common_voice_en_29890305-common_voice_en_29890302,Such calls are classified as failed call attempts.,Such calls are classified as failed call attempts.,0.000000,0,0,0,8,3.4400,0.0000,True,
common_voice_en_30232728-common_voice_en_30232725,The economic activity of the Pampas district is not oriented to tourism.,The economic activity of the Pampas district is not oriented to tourism.,0.000000,0,0,0,12,5.6373,0.0000,True,
common_voice_en_30232728-common_voice_en_30232726,The economic activity of the Pampas district is not oriented to tourism.,The economic activity of the Pampas district is not oriented to tourism.,0.000000,0,0,0,12,5.6373,0.0000,True,
common_voice_en_30471104-common_voice_en_30471105,Trump pressured Republican officials in key states to block the certification of votes.,Trump pressured Republican officials in key states to block the certification of votes.,0.000000,0,0,0,13,5.1040,0.0000,True,
common_voice_en_30619661-common_voice_en_30619659,"These initial four films were made using unused material from ""State of Play"".",These initial four films were made using unused material from *State of Play*.,0.000000,0,0,0,13,4.2400,0.0000,True,
common_voice_en_30619661-common_voice_en_30619662,"These initial four films were made using unused material from ""State of Play"".",These initial four films were made using unused material from State of Play.,0.000000,0,0,0,13,4.2400,0.0000,True,
common_voice_en_30665077-common_voice_en_30665078,The sidewalks are narrow and buildings are located close to the property line.,"The sidewalks are narrow, and buildings are located close to the property line.",0.000000,0,0,0,13,5.3387,0.0000,True,
common_voice_en_30665077-common_voice_en_30665079,The sidewalks are narrow and buildings are located close to the property line.,"The sidewalks are narrow, and buildings are located close to the property line.",0.000000,0,0,0,13,5.3387,0.0000,True,
common_voice_en_30735432-common_voice_en_30735431,She received an honours degree in English at the University of Cape Town.,She received an honors degree in English at the University of Cape Town.,0.000000,0,0,0,13,5.4364,0.0000,True,
common_voice_en_30735432-common_voice_en_30735433,She received an honours degree in English at the University of Cape Town.,She received an honors degree in English at the University of Cape Town.,0.000000,0,0,0,13,5.4364,0.0000,True,
common_voice_en_30757408-common_voice_en_30757409,Barassi closed in last place all three races in which he participated.,Barassi closed in last place all three races in which he participated.,0.000000,0,0,0,12,4.3893,0.0000,True,
common_voice_en_30883223-common_voice_en_30883220,Sullivan completed her undergraduate studies at Princeton University.,Sullivan completed her undergraduate studies at Princeton University.,0.000000,0,0,0,8,3.9840,0.0000,True,
common_voice_en_31005683-common_voice_en_31005688,The recreation center has been transformed today into the Peaceful Valley Community Center.,The recreation center has been transformed today into the Peaceful Valley Community Center.,0.000000,0,0,0,13,6.2400,0.0000,True,
common_voice_en_31005683-common_voice_en_31005691,The recreation center has been transformed today into the Peaceful Valley Community Center.,The recreation center has been transformed today into the Peaceful Valley Community Center.,0.000000,0,0,0,13,6.2400,0.0000,True,
common_voice_en_31350445-common_voice_en_31350446,The trip was also delayed further due to strong winds and inclement weather.,The trip was also delayed further due to strong winds and inclement weather.,0.000000,0,0,0,13,4.5120,0.0000,True,
common_voice_en_31497532-common_voice_en_31497530,Promotions picked back up again in November of the same year.,Promotions picked back up again in November of the same year.,0.000000,0,0,0,11,3.4400,0.0000,True,
common_voice_en_31497532-common_voice_en_31497531,Promotions picked back up again in November of the same year.,Promotions picked back up again in November of the same year.,0.000000,0,0,0,11,3.4400,0.0000,True,
common_voice_en_31499885-common_voice_en_31499889,She was educated at home and studied art with several Spanish painters.,She was educated at home and studied art with several Spanish painters.,0.000000,0,0,0,12,4.7234,0.0000,True,
common_voice_en_31499885-common_voice_en_31499906,She was educated at home and studied art with several Spanish painters.,She was educated at home and studied art with several Spanish painters.,0.000000,0,0,0,12,4.7234,0.0000,True,
common_voice_en_31576099-common_voice_en_31576097,They would never be seen by people again.,They would never be seen by people again.,0.000000,0,0,0,8,3.6573,0.0000,True,
common_voice_en_31776611-common_voice_en_31776613,The published version was dedicated to the politician Lord Berkeley.,The published version was dedicated to the politician Lord Berkeley.,0.000000,0,0,0,10,5.9360,0.0000,True,
common_voice_en_31892400-common_voice_en_31892402,He made it to India but his pregnant wife returned to Rangoon alone.,"He made it to India, but his pregnant wife returned to Rangoon alone.",0.000000,0,0,0,13,4.3147,0.0000,True,
common_voice_en_31892400-common_voice_en_31892404,He made it to India but his pregnant wife returned to Rangoon alone.,"He made it to India, but his pregnant wife returned to Rangoon alone.",0.000000,0,0,0,13,4.3147,0.0000,True,
common_voice_en_31959919-common_voice_en_31959922,The Turkish operation received mixed responses by the international community.,The Turkish operation received mixed responses by the international community.,0.000000,0,0,0,10,5.0400,0.0000,True,
common_voice_en_31959919-common_voice_en_31959927,The Turkish operation received mixed responses by the international community.,The Turkish operation received mixed responses by the international community.,0.000000,0,0,0,10,5.0400,0.0000,True,
common_voice_en_32101327-common_voice_en_32101328,He and Wanda turn against Ultron and join the Avengers at the Avengers Tower.,He and Wanda turn against Ultron and join the Avengers at the Avengers Tower.,0.000000,0,0,0,14,3.9307,0.0000,True,
common_voice_en_32101327-common_voice_en_32101329,He and Wanda turn against Ultron and join the Avengers at the Avengers Tower.,He and Wanda turn against Ultron and join the Avengers at the Avengers Tower.,0.000000,0,0,0,14,3.9307,0.0000,True,
common_voice_en_32111431-common_voice_en_32111428,The spelling and punctuation of many of his titles were unorthodox.,The spelling and punctuation of many of his titles were unorthodox.,0.000000,0,0,0,11,4.3093,0.0000,True,
common_voice_en_32111431-common_voice_en_32111430,The spelling and punctuation of many of his titles were unorthodox.,The spelling and punctuation of many of his titles were unorthodox.,0.000000,0,0,0,11,4.3093,0.0000,True,
common_voice_en_32125519-common_voice_en_32125523,Many Indigenous people are now speaking and publishing about their family stories and experiences.,Many indigenous people are now speaking and publishing about their family stories and experiences.,0.000000,0,0,0,14,6.9973,0.0000,True,
common_voice_en_32125519-common_voice_en_32125526,Many Indigenous people are now speaking and publishing about their family stories and experiences.,Many indigenous people are now speaking and publishing about their family stories and experiences.,0.000000,0,0,0,14,6.9973,0.0000,True,
common_voice_en_32144882-common_voice_en_32144885,It is located from the Wellington central business district.,It is located from the Wellington Central Business District.,0.000000,0,0,0,9,3.9051,0.0000,True,
common_voice_en_32144882-common_voice_en_32144886,It is located from the Wellington central business district.,It is located from the Wellington Central Business District.,0.000000,0,0,0,9,3.9051,0.0000,True,
common_voice_en_32174871-common_voice_en_32174873,Bernhard and her husband Bill Bernhard have two children together.,Bernhard and her husband Bill Bernhard have two children together.,0.000000,0,0,0,10,4.1600,0.0000,True,
common_voice_en_32174871-common_voice_en_32174874,Bernhard and her husband Bill Bernhard have two children together.,Bernhard and her husband Bill Bernhard have two children together.,0.000000,0,0,0,10,4.1600,0.0000,True,
common_voice_en_32263901-common_voice_en_32263900,It was probably written in the first decade of the century.,It was probably written in the first decade of the century.,0.000000,0,0,0,11,3.1253,0.0000,True,
common_voice_en_32279839-common_voice_en_32279841,The Film Festival was free and sponsored by Cash App.,The film festival was free and sponsored by Cash App.,0.000000,0,0,0,10,3.3945,0.0000,True,
common_voice_en_32298822-common_voice_en_32298846,The citizens of Beach City wave goodbye as Steven begins his road trip.,The citizens of Beach City wave goodbye as Stephen begins his road trip.,0.076923,1,0,0,12,4.3874,0.0000,True,
common_voice_en_32298822-common_voice_en_32298878,The citizens of Beach City wave goodbye as Steven begins his road trip.,The citizens of Beach City wave goodbye as Stephen begins his road trip.,0.076923,1,0,0,12,4.3874,0.0000,True,
common_voice_en_32377071-common_voice_en_32377070,The community was originally known as Poplar Spring but later known as Fort Dale.,"The community was originally known as Poplar Springs, but later known as Fort Dale.",0.071429,1,0,0,13,5.2320,0.0000,True,
common_voice_en_32377071-common_voice_en_32377072,The community was originally known as Poplar Spring but later known as Fort Dale.,"The community was originally known as Poplar Spring, but later known as Fort Dale.",0.000000,0,0,0,14,5.2320,0.0000,True,
common_voice_en_32638726-common_voice_en_32638729,The couple traveled with and served in the church all their lives.,The couple traveled with and served in the church all their lives.,0.000000,0,0,0,12,4.5585,0.0000,True,
common_voice_en_32641373-common_voice_en_32641375,Youth Congress always remained in highlights of the leading state news.,Youth Congress always remained in highlights of the leading state news.,0.000000,0,0,0,11,4.5867,0.0000,True,
common_voice_en_32641373-common_voice_en_32641377,Youth Congress always remained in highlights of the leading state news.,Youth Congress always remained in highlights of the leading state news.,0.000000,0,0,0,11,4.5867,0.0000,True,
common_voice_en_32683120-common_voice_en_32683117,It is published by the Moscow Digital Media private limited company.,It is published by the Moscow Digital Media Private Limited Company.,0.000000,0,0,0,11,4.9315,0.0000,True,
common_voice_en_32683120-common_voice_en_32683121,It is published by the Moscow Digital Media private limited company.,It is published by the Moscow Digital Media Private Limited Company.,0.000000,0,0,0,11,4.9315,0.0000,True,
common_voice_en_32697372-common_voice_en_32697370,Most children were from former Soviet republics and former Yugoslavia.,Most children were from former Soviet republics and former Yugoslavia.,0.000000,0,0,0,10,6.0747,0.0000,True,
common_voice_en_32697372-common_voice_en_32697449,Most children were from former Soviet republics and former Yugoslavia.,Most children were from former Soviet republics and former Yugoslavia.,0.000000,0,0,0,10,6.0747,0.0000,True,
