id,target_text,whisper_text,wer,substitutions,deletions,insertions,hits,audio_duration_s,latency_s,is_success,error
common_voice_en_20252760-common_voice_en_20252766,"Where plays are put on yearly, with months of practices.","Where plays are put on yearly, with months of practices.",0.000000,0,0,0,10,4.4747,0.0000,True,
common_voice_en_20262152-common_voice_en_20262155,This implied accommodation close to the armed forces' Central War Room.,This implied accommodation close to the armed forces' central war room.,0.000000,0,0,0,11,4.2545,0.0000,True,
common_voice_en_20266775-common_voice_en_20266781,"During World War One, Strong served overseas in France with American Expeditionary Forces.","During World War One, Strong served overseas in France with American Expeditionary Forces.",0.000000,0,0,0,13,5.9715,0.0000,True,
common_voice_en_20273907-common_voice_en_20273911,"Each character has a role such as medic, sniper, scout, grenadier, soldier or engineer.","Each character has a role, such as medic, sniper, scout, grenadier, soldier, or engineer.",0.000000,0,0,0,14,5.7653,0.0000,True,
common_voice_en_20285294-common_voice_en_20285291,The composition and specific functions of the signoria varied from city to city.,The composition and specific functions of the signoria varied from city to city.,0.000000,0,0,0,13,4.6027,0.0000,True,
common_voice_en_20285294-common_voice_en_20285295,The composition and specific functions of the signoria varied from city to city.,The composition and specific functions of the signoria varied from city to city.,0.000000,0,0,0,13,4.6027,0.0000,True,
common_voice_en_20289354-common_voice_en_20289351,Travel time is approximately two and a half to three hours by land.,Travel time is approximately two and a half to three hours by land.,0.000000,0,0,0,10,4.2667,0.0000,True,
common_voice_en_20289354-common_voice_en_20289353,Travel time is approximately two and a half to three hours by land.,Travel time is approximately two and a half to three hours by land.,0.000000,0,0,0,10,4.2667,0.0000,True,
common_voice_en_20297680-common_voice_en_20297678,"One of the babies appeared to be wearing a bronze torque, or collar.",One of the babies appeared to be wearing a bronze torque or collar.,0.000000,0,0,0,13,3.9520,0.0000,True,
common_voice_en_20297680-common_voice_en_20297682,"One of the babies appeared to be wearing a bronze torque, or collar.",One of the babies appeared to be wearing a bronze torque or a collar.,0.076923,0,0,1,13,3.9520,0.0000,True,
common_voice_en_20303932-common_voice_en_20303930,"The implication works both ways, and thus the universal is bidirectional.","The implication works both ways, and thus the universal is bidirectional.",0.000000,0,0,0,11,5.9413,0.0000,True,
common_voice_en_20303932-common_voice_en_20303934,"The implication works both ways, and thus the universal is bidirectional.","The implication works both ways, and thus the universal is bidirectional.",0.000000,0,0,0,11,5.9413,0.0000,True,
common_voice_en_20304148-common_voice_en_20304149,The local Best Western hotel is also named after him.,The local Best Western hotel is also named after him.,0.000000,0,0,0,10,3.4707,0.0000,True,
common_voice_en_20304708-common_voice_en_20304710,"The healthier a person is, the less likely problems may arise.","The healthier a person is, the less likely problems may arise.",0.000000,0,0,0,11,4.1125,0.0000,True,
common_voice_en_20317297-common_voice_en_20317298,It is located on a small plain home to many vineyards.,"It is located on a small plain, home to many vineyards.",0.000000,0,0,0,11,3.4347,0.0000,True,
common_voice_en_20317297-common_voice_en_20317300,It is located on a small plain home to many vineyards.,"It is located on a small plain, home to many vineyards.",0.000000,0,0,0,11,3.4347,0.0000,True,
common_voice_en_20323109-common_voice_en_20323110,Its typical lifespan in captivity is around four to six years.,Its typical lifespan in captivity is around four to six years.,0.000000,0,0,0,11,3.9947,0.0000,True,
common_voice_en_203357-common_voice_en_203358,I found a little crowd of about twenty people surrounding the huge hole.,I found a little crowd of about twenty people surrounding the huge hole.,0.000000,0,0,0,13,4.3387,0.0000,True,
common_voice_en_203357-common_voice_en_203359,I found a little crowd of about twenty people surrounding the huge hole.,I found a little crowd of about twenty people surrounding the huge hole.,0.000000,0,0,0,13,4.3387,0.0000,True,
common_voice_en_20337838-common_voice_en_20337841,"Previously an attorney, Korona left the profession to pursue a career in music.","Previously, an attorney, Corona left the profession to pursue a career in music.",0.076923,1,0,0,12,4.8480,0.0000,True,
common_voice_en_20337838-common_voice_en_20337842,"Previously an attorney, Korona left the profession to pursue a career in music.","Previously, an attorney, Corona left the profession to pursue a career in music.",0.076923,1,0,0,12,4.8480,0.0000,True,
common_voice_en_20342901-common_voice_en_20342897,He had the great sadness of surviving all his contemporaries.,He had great sadness of surviving all his contemporaries.,0.100000,0,1,0,9,4.9280,0.0000,True,
common_voice_en_20410042-common_voice_en_20410055,Miri grew as fast as the rate of oil production by the Shell company.,Mary grew as fast as the rate of oil production by the Shell Company.,0.071429,1,0,0,13,3.7837,0.0000,True,
common_voice_en_20451876-common_voice_en_20451880,Some of the vowels are also represented using different letter combinations.,Some of the vowels are also represented using different letter combinations.,0.000000,0,0,0,11,4.3893,0.0000,True,
common_voice_en_20461046-common_voice_en_20461051,He flicks his lighter and the house goes up in a fiery explosion.,"He flicks his lighter, and the house goes up in a fiery explosion.",0.000000,0,0,0,13,4.1440,0.0000,True,
common_voice_en_20522396-common_voice_en_20522395,Haiti is positioned between the Caribbean Sea and the North Atlantic Ocean.,Haiti is positioned between the Caribbean Sea and the North Atlantic Ocean.,0.000000,0,0,0,12,6.8136,0.0000,True,
common_voice_en_20522396-common_voice_en_20522398,Haiti is positioned between the Caribbean Sea and the North Atlantic Ocean.,Haiti is positioned between the Caribbean Sea and the North Atlantic Ocean.,0.000000,0,0,0,12,6.8136,0.0000,True,
common_voice_en_20531306-common_voice_en_20531308,"They have traveled across the world, playing at churches, conferences, and festivals.","They have traveled across the world, playing at churches, conferences, and festivals.",0.000000,0,0,0,12,5.7920,0.0000,True,
common_voice_en_20531306-common_voice_en_20531309,"They have traveled across the world, playing at churches, conferences, and festivals.","They have travelled across the world, playing at churches, conferences, and festivals.",0.000000,0,0,0,12,5.7920,0.0000,True,
common_voice_en_20535791-common_voice_en_20535795,"With only two torpedoes remaining, she was ordered home from patrol.","With only two torpedoes remaining, she was ordered home from patrol.",0.000000,0,0,0,11,3.9680,0.0000,True,
common_voice_en_205647-common_voice_en_205648,Many people are traumatized after this sailing accident and need intensive care.,Many people are traumatized after the sailing accident and need intensive care.,0.083333,1,0,0,11,4.7467,0.0000,True,
common_voice_en_205647-common_voice_en_205649,Many people are traumatized after this sailing accident and need intensive care.,Many people are traumatized after the sailing accident and need intensive care.,0.083333,1,0,0,11,4.7467,0.0000,True,
common_voice_en_20583510-common_voice_en_20583509,Purvis was the daughter of a Methodist minister in Pennsylvania.,Purvis was the daughter of a Methodist minister in Pennsylvania.,0.000000,0,0,0,10,4.2739,0.0000,True,
common_voice_en_20583510-common_voice_en_20583514,Purvis was the daughter of a Methodist minister in Pennsylvania.,Pervis was the daughter of a Methodist minister in Pennsylvania.,0.100000,1,0,0,9,4.2739,0.0000,True,
common_voice_en_20617-common_voice_en_20618,I think they perceived that nothing was to be done at the moment.,I think they perceived that nothing was to be done at the moment.,0.000000,0,0,0,13,3.6347,0.0000,True,
common_voice_en_20617-common_voice_en_20619,I think they perceived that nothing was to be done at the moment.,I think they perceived that nothing was to be done at the moment.,0.000000,0,0,0,13,3.6347,0.0000,True,
common_voice_en_20640019-common_voice_en_20640018,Then he asked one of the reporters to fetch him a bucket of water.,Then he asked one of the reporters to fetch him a bucket of water.,0.000000,0,0,0,14,4.1279,0.0000,True,
common_voice_en_20640019-common_voice_en_20640020,Then he asked one of the reporters to fetch him a bucket of water.,Then he asked one of the reporters to fetch him a bucket of water.,0.000000,0,0,0,14,4.1279,0.0000,True,
common_voice_en_20660224-common_voice_en_20660226,"High gain is also used to induce audio feedback, which increases sustain dramatically.","High gain is also used to induce audio feedback, which increases sustain dramatically.",0.000000,0,0,0,13,5.8529,0.0000,True,
common_voice_en_20660224-common_voice_en_20660228,"High gain is also used to induce audio feedback, which increases sustain dramatically.","High gain is also used to induce audio feedback, which increases sustain dramatically.",0.000000,0,0,0,13,5.8529,0.0000,True,
common_voice_en_20661858-common_voice_en_20661860,Soon after the band signed to Century Media Records.,Soon after the band signed to Century Media Records.,0.000000,0,0,0,9,4.3520,0.0000,True,
common_voice_en_20661858-common_voice_en_20661861,Soon after the band signed to Century Media Records.,Soon after the band signed to Century Media Records.,0.000000,0,0,0,9,4.3520,0.0000,True,
common_voice_en_20688082-common_voice_en_20688081,Populations of the same species from different latitudes may also follow Allen's rule.,Populations of the same species from different latitudes may also follow Allen's rule.,0.000000,0,0,0,14,6.0533,0.0000,True,
common_voice_en_20688082-common_voice_en_20688083,Populations of the same species from different latitudes may also follow Allen's rule.,Populations of the same species from different latitudes may also follow Allen's rule.,0.000000,0,0,0,14,6.0533,0.0000,True,
common_voice_en_20718170-common_voice_en_20718169,"Historically, the main reason for purchasing hubs rather than switches was their price.","Historically, the main reason for purchasing hubs rather than switches was their price.",0.000000,0,0,0,13,4.4693,0.0000,True,
common_voice_en_2072999-common_voice_en_2073000,I have blisters on my hands because I was bouldering yesterday.,I have blisters on my hands because I was bouldering yesterday.,0.000000,0,0,0,11,4.0725,0.0000,True,
common_voice_en_2072999-common_voice_en_2324746,I have blisters on my hands because I was bouldering yesterday.,I have blisters on my hands because I was bouldering yesterday.,0.000000,0,0,0,11,4.0725,0.0000,True,
common_voice_en_20735803-common_voice_en_20735805,"It lies entirely in the county of Lincolnshire, England.","It lies entirely in the county of Lincolnshire, England.",0.000000,0,0,0,9,4.4533,0.0000,True,
common_voice_en_20735803-common_voice_en_20735807,"It lies entirely in the county of Lincolnshire, England.","It lies entirely in the county of Lincolnshire, England.",0.000000,0,0,0,9,4.4533,0.0000,True,
common_voice_en_20791113-common_voice_en_20791116,It is currently the oldest preserved Union Pacific steam locomotive.,It is currently the oldest preserved Union Pacific steam locomotive.,0.000000,0,0,0,10,4.8818,0.0000,True,
common_voice_en_20791113-common_voice_en_20791117,It is currently the oldest preserved Union Pacific steam locomotive.,It is currently the oldest preserved Union Pacific steam locomotive.,0.000000,0,0,0,10,4.8818,0.0000,True,
common_voice_en_20791578-common_voice_en_20791579,He personally removed several wounded men and was the last to leave the village.,He personally removed several wounded men and was the last to leave the village.,0.000000,0,0,0,14,4.1815,0.0000,True,
common_voice_en_20791578-common_voice_en_20791581,He personally removed several wounded men and was the last to leave the village.,He personally removed several wounded men and was the last to leave the village.,0.000000,0,0,0,14,4.1815,0.0000,True,
common_voice_en_20791751-common_voice_en_20791750,"He also appeared as the voice of the villain Stalker on ""Batman Beyond"".",He also appeared as the voice of the villain Stalker on Batman Beyond.,0.000000,0,0,0,13,4.6347,0.0000,True,
common_voice_en_20791751-common_voice_en_20791752,"He also appeared as the voice of the villain Stalker on ""Batman Beyond"".",He also appeared as the voice of the villain Stalker on Batman Beyond.,0.000000,0,0,0,13,4.6347,0.0000,True,
common_voice_en_20798109-common_voice_en_20798113,"Both, however, set the laws in an explicitly religious context.","Both, however, set the laws in an explicitly religious context.",0.000000,0,0,0,10,4.1049,0.0000,True,
common_voice_en_20806032-common_voice_en_20806033,"Also, the town is pursuing increased tourism based on its ancient Serer culture.","Also, the town is pursuing increased tourism based on its ancient Sarir culture.",0.076923,1,0,0,12,5.6693,0.0000,True,
common_voice_en_20812017-common_voice_en_20812019,"The historical centre of the town, with narrow streets, is still intact.","The historical center of the town, with narrow streets, is still intact.",0.000000,0,0,0,12,4.3573,0.0000,True,
common_voice_en_20812017-common_voice_en_20812020,"The historical centre of the town, with narrow streets, is still intact.","The historical center of the town, with narrow streets, is still intact.",0.000000,0,0,0,12,4.3573,0.0000,True,
common_voice_en_20834082-common_voice_en_20834083,It does not comment on specific disputes.,It does not comment on specific disputes.,0.000000,0,0,0,7,3.1051,0.0000,True,
common_voice_en_20872043-common_voice_en_20872044,The exclusion of professionals caused several controversies throughout the history of the modern Olympics.,The exclusion of professionals caused several controversies throughout the history of the modern Olympics.,0.000000,0,0,0,14,4.8747,0.0000,True,
common_voice_en_20872043-common_voice_en_20872046,The exclusion of professionals caused several controversies throughout the history of the modern Olympics.,The exclusion of professionals caused several controversies throughout the history of the modern Olympics.,0.000000,0,0,0,14,4.8747,0.0000,True,
common_voice_en_20872478-common_voice_en_20872479,He resides in New York and London.,He resides in New York and London.,0.000000,0,0,0,7,3.3051,0.0000,True,
common_voice_en_20872478-common_voice_en_20872481,He resides in New York and London.,He resides in New York and London.,0.000000,0,0,0,7,3.3051,0.0000,True,
common_voice_en_20888046-common_voice_en_20888048,This marked the official beginning of the university as it is today.,This marked the official beginning of the university as it is today.,0.000000,0,0,0,12,3.4400,0.0000,True,
common_voice_en_20888046-common_voice_en_20888051,This marked the official beginning of the university as it is today.,This marked the official beginning of the university as it is today.,0.000000,0,0,0,12,3.4400,0.0000,True,
common_voice_en_20905661-common_voice_en_20905660,"He was interested in music and cooking and food, he was very companionable.",He was interested in music and cooking and food. He was very companionable.,0.000000,0,0,0,13,4.0533,0.0000,True,
common_voice_en_20905661-common_voice_en_20905662,"He was interested in music and cooking and food, he was very companionable.",He was interested in music and cooking and food. He was very companionable.,0.000000,0,0,0,13,4.0533,0.0000,True,
common_voice_en_20907200-common_voice_en_20907214,Approximately half of the students and faculty members come from overseas.,Approximately half of the students and faculty members come from overseas.,0.000000,0,0,0,11,5.7558,0.0000,True,
common_voice_en_20907200-common_voice_en_20907217,Approximately half of the students and faculty members come from overseas.,Approximately half of the students and faculty members come from overseas.,0.000000,0,0,0,11,5.7558,0.0000,True,
common_voice_en_20918607-common_voice_en_20918611,He was the last surviving child of William Henry Harrison.,He was the last surviving child of William Henry Harrison.,0.000000,0,0,0,10,3.9761,0.0000,True,
common_voice_en_209233-common_voice_en_209236,"I'm afraid that if my dream is realized, I'll have no reason to go on living.","I'm afraid that if my dream is realized, I'll have no reason to go on living.",0.000000,0,0,0,18,5.6520,0.0000,True,
common_voice_en_209233-common_voice_en_209237,"I'm afraid that if my dream is realized, I'll have no reason to go on living.","I'm afraid that if my dream is realized, I'll have no reason to go on living.",0.000000,0,0,0,18,5.6520,0.0000,True,
common_voice_en_20933101-common_voice_en_20933102,"The eggs are pale yellow when first laid, but become pale brown.","The eggs are pale yellow when first laid, but become pale brown.",0.000000,0,0,0,12,5.1147,0.0000,True,
common_voice_en_20933101-common_voice_en_20933104,"The eggs are pale yellow when first laid, but become pale brown.","The eggs are pale yellow when first laid, but become pale brown.",0.000000,0,0,0,12,5.1147,0.0000,True,
common_voice_en_20938865-common_voice_en_20938864,Grassley also began an investigation about unreported payments to physicians by pharmaceutical companies.,Grassley also began an investigation about unreported payments to physicians by pharmaceutical companies.,0.000000,0,0,0,13,5.9852,0.0000,True,
common_voice_en_20938865-common_voice_en_20938866,Grassley also began an investigation about unreported payments to physicians by pharmaceutical companies.,Grassley also began an investigation about unreported payments to physicians by pharmaceutical companies.,0.000000,0,0,0,13,5.9852,0.0000,True,
common_voice_en_20972789-common_voice_en_20972791,Members and associate members are calculated in advance.,Members and associate members are calculated in advance.,0.000000,0,0,0,8,4.1653,0.0000,True,
common_voice_en_20972789-common_voice_en_20972792,Members and associate members are calculated in advance.,Members and associate members are calculated in advance.,0.000000,0,0,0,8,4.1653,0.0000,True,
common_voice_en_21059484-common_voice_en_21059406,Higher Grade qualifications can be taken in both the fifth and sixth years.,Higher grade qualifications can be taken in both the fifth and sixth years.,0.000000,0,0,0,13,4.8502,0.0000,True,
common_voice_en_21059484-common_voice_en_21059485,Higher Grade qualifications can be taken in both the fifth and sixth years.,Higher grade qualifications can be taken in both the fifth and sixth years.,0.000000,0,0,0,13,4.8502,0.0000,True,
common_voice_en_21106663-common_voice_en_21106664,He was a founding member of the Alliance Party of Northern Ireland.,He was a founding member of the Alliance Party of Northern Ireland.,0.000000,0,0,0,12,3.9692,0.0000,True,
common_voice_en_21129372-common_voice_en_21129375,Tempest are another Northern Irish clothing store with a store in the Republic.,Tempest are another Northern Irish clothing store with a store in the Republic.,0.000000,0,0,0,13,4.2563,0.0000,True,
common_voice_en_21129372-common_voice_en_21129377,Tempest are another Northern Irish clothing store with a store in the Republic.,Tempest are another Northern Irish clothing store with a store in the Republic.,0.000000,0,0,0,13,4.2563,0.0000,True,
common_voice_en_21139160-common_voice_en_21139162,Additional support is also available to agencies through the Center's Forensic Services Unit.,Additional support is also available to agencies through the center's forensic services unit.,0.000000,0,0,0,14,5.4613,0.0000,True,
common_voice_en_21184954-common_voice_en_21184958,One who performs conjurations is called a conjurer or conjuror.,One who performs conjurations is called a conjurer or conjurer.,0.100000,1,0,0,9,4.2827,0.0000,True,
common_voice_en_21184954-common_voice_en_21184959,One who performs conjurations is called a conjurer or conjuror.,One who performs conjurations is called a conjurer or conjuror.,0.000000,0,0,0,10,4.2827,0.0000,True,
common_voice_en_21291499-common_voice_en_21291501,"The party also supported laws criminalizing the ""sexual maltreatment"" of animals.",The party also supported laws criminalizing the sexual maltreatment of animals.,0.000000,0,0,0,11,4.8890,0.0000,True,
common_voice_en_21293493-common_voice_en_21293494,"After the child's birth, the affair ended for unknown reasons.","After the child's birth, the affair ended for unknown reasons.",0.000000,0,0,0,11,4.0052,0.0000,True,
common_voice_en_21314759-common_voice_en_21314758,"More importantly, limitations imposed by gap distance limits the actuation distance.","More importantly, limitations imposed by gap distance limits the actuation distance.",0.000000,0,0,0,11,5.7653,0.0000,True,
common_voice_en_21319256-common_voice_en_21319257,"Treatment is possible but unless continued daily, problems may arise.","Treatment is possible, but unless continued daily, problems may arise.",0.000000,0,0,0,10,4.1813,0.0000,True,
common_voice_en_21345624-common_voice_en_21345625,Varberg is located in a terrain of hills and plains.,Varberg is located in a terrain of hills and plains.,0.000000,0,0,0,10,3.5840,0.0000,True,
common_voice_en_21345624-common_voice_en_21345626,Varberg is located in a terrain of hills and plains.,Varberg is located in a terrain of hills and plains.,0.000000,0,0,0,10,3.5840,0.0000,True,
common_voice_en_21352017-common_voice_en_21352021,The building is now offices.,The building is now offices.,0.000000,0,0,0,5,3.2000,0.0000,True,
common_voice_en_21370640-common_voice_en_21370642,"Mashu, the high mountain from which the sun comes into the sky.","Machu, the high mountain from which the sun comes into the sky.",0.083333,1,0,0,11,5.1051,0.0000,True,
common_voice_en_21444162-common_voice_en_21444161,It was also used for the closely related Slovak language.,It was also used for the closely related Slovak language.,0.000000,0,0,0,10,3.9413,0.0000,True,
common_voice_en_21444162-common_voice_en_21444163,It was also used for the closely related Slovak language.,It was also used for the closely related Slovak language.,0.000000,0,0,0,10,3.9413,0.0000,True,
common_voice_en_21499767-common_voice_en_21499784,A process assembly represents a process that will use classes defined in library assemblies.,A process assembly represents a process that will use classes defined in library assemblies.,0.000000,0,0,0,14,6.0800,0.0000,True,
common_voice_en_21499767-common_voice_en_21499786,A process assembly represents a process that will use classes defined in library assemblies.,A process assembly represents a process that will use classes defined in library assemblies.,0.000000,0,0,0,14,6.0800,0.0000,True,
common_voice_en_21504874-common_voice_en_21504872,Its legal status in Trinidad was insufficient to preserve its ecological status.,Its legal status in Trinidad was insufficient to preserve its ecological status.,0.000000,0,0,0,12,4.5492,0.0000,True,
common_voice_en_21504874-common_voice_en_21504873,Its legal status in Trinidad was insufficient to preserve its ecological status.,Its legal status in Trinidad was insufficient to preserve its ecological status.,0.000000,0,0,0,12,4.5492,0.0000,True,
common_voice_en_21534516-common_voice_en_21534520,"At Jericho Mills, Warren found the river ford unprotected.","At Jericho Mills, Warren found the river ford unprotected.",0.000000,0,0,0,9,3.7875,0.0000,True,
common_voice_en_21538043-common_voice_en_21538044,If it stayed in place they were not guilty.,"If it stayed in place, they were not guilty.",0.000000,0,0,0,9,3.4728,0.0000,True,
common_voice_en_21538043-common_voice_en_21538045,If it stayed in place they were not guilty.,"If it stayed in place, they were not guilty.",0.000000,0,0,0,9,3.4728,0.0000,True,
common_voice_en_21551805-common_voice_en_21551806,"It also mentions the qualities of its people: peace, justice, and liberty.","It also mentions the qualities of its people: peace, justice, and liberty.",0.000000,0,0,0,12,7.1051,0.0000,True,
common_voice_en_21555451-common_voice_en_21555449,"He drew inspiration from James Stewart's performance in ""Harvey"".",He drew inspiration from James Stewart's performance in *Harvey*.,0.000000,0,0,0,10,5.0827,0.0000,True,
common_voice_en_21555451-common_voice_en_21555450,"He drew inspiration from James Stewart's performance in ""Harvey"".",He drew inspiration from James Stewart's performance in *Harvey*.,0.000000,0,0,0,10,5.0827,0.0000,True,
common_voice_en_21555942-common_voice_en_21555944,"He is patron of the Shandar Smith Foundation, a charity for children with cancer.","He is patron of the Shandar Smith Foundation, a charity for children with cancer.",0.000000,0,0,0,14,5.8091,0.0000,True,
common_voice_en_21555942-common_voice_en_21555950,"He is patron of the Shandar Smith Foundation, a charity for children with cancer.","He is patron of the Shandar Smith Foundation, a charity for children with cancer.",0.000000,0,0,0,14,5.8091,0.0000,True,
common_voice_en_21589881-common_voice_en_21589882,Bombelles was the former custodian of his aunt Empress Charlotte of Mexico.,"Bombelles was the former custodian of his aunt, Empress Charlotte of Mexico.",0.000000,0,0,0,12,4.3413,0.0000,True,
common_voice_en_21589881-common_voice_en_21589886,Bombelles was the former custodian of his aunt Empress Charlotte of Mexico.,"Bombelles was the former custodian of his aunt, Empress Charlotte of Mexico.",0.000000,0,0,0,12,4.3413,0.0000,True,
