id,target_text,whisper_text,wer,substitutions,deletions,insertions,hits,audio_duration_s,latency_s,is_success,error
common_voice_en_10119832-common_voice_en_10119840,"We asked over twenty different people, and they all said it was his.","We asked over twenty different people, and they all said it was his.",0.000000,0,0,0,13,3.9040,0.0000,True,
common_voice_en_10119832-common_voice_en_10119847,"We asked over twenty different people, and they all said it was his.","We asked over twenty different people, and they all said it was his.",0.000000,0,0,0,13,3.9040,0.0000,True,
common_voice_en_103675-common_voice_en_103676,I'm never more aware of a room's acoustics than when I'm trying to enjoy a snack I have no intention of sharing.,I'm never more aware of a room's cos tics than when I'm trying to enjoy a snack. I have no intention of sharing.,0.080000,1,0,1,24,6.4853,0.0000,True,
common_voice_en_103675-common_voice_en_103677,I'm never more aware of a room's acoustics than when I'm trying to enjoy a snack I have no intention of sharing.,I'm never more aware of a room's acoustics than when I'm trying to enjoy a snack. I have no intention of sharing.,0.000000,0,0,0,25,6.4853,0.0000,True,
common_voice_en_10933823-common_voice_en_10933822,Sometimes I overthink things which leads me to postpone and ultimately never achieve the goal I had in mind.,"Sometimes I overthink things, which leads me to postpone and ultimately never achieve the goal I had in mind.",0.000000,0,0,0,19,7.7823,0.0000,True,
common_voice_en_10933823-common_voice_en_10933825,Sometimes I overthink things which leads me to postpone and ultimately never achieve the goal I had in mind.,"Sometimes I overthink things, which leads me to postpone and, ultimately, never achieve the goal I had in mind.",0.000000,0,0,0,19,7.7823,0.0000,True,
common_voice_en_120405-common_voice_en_120402,He approached the mass and was surprised at the size and the shape.,"He approached the mass, and was surprised at the size and the shape.",0.000000,0,0,0,13,6.0629,0.0000,True,
common_voice_en_120405-common_voice_en_120406,He approached the mass and was surprised at the size and the shape.,"He approached the mass, and was surprised at the size and the shape.",0.000000,0,0,0,13,6.0629,0.0000,True,
common_voice_en_1205005-common_voice_en_1205007,"Roaming endlessly around the park, she wants to go home.","Roaming endlessly around the park, she wants to go home.",0.000000,0,0,0,10,3.7013,0.0000,True,
common_voice_en_1205005-common_voice_en_1205008,"Roaming endlessly around the park, she wants to go home.","Roaming endlessly around the park, she wants to go home.",0.000000,0,0,0,10,3.7013,0.0000,True,
common_voice_en_123125-common_voice_en_123126,"""There's no danger,"" the boy said, when they had moved on past the encampment.","There is no danger,"" the boys said when they had moved on past the encampment.",0.066667,1,0,0,14,4.5120,0.0000,True,
common_voice_en_123125-common_voice_en_123127,"""There's no danger,"" the boy said, when they had moved on past the encampment.","There is no danger,"" the boys said when they had moved on past the encampment.",0.066667,1,0,0,14,4.5120,0.0000,True,
common_voice_en_125386-common_voice_en_125388,"It was, however, still so hot from its flight through the air.","It was, however, still so hot from its flight through the air.",0.000000,0,0,0,12,3.9787,0.0000,True,
common_voice_en_125386-common_voice_en_125389,"It was, however, still so hot from its flight through the air.","It was, however, still so hot from its flight through the air.",0.000000,0,0,0,12,3.9787,0.0000,True,
common_voice_en_137148-common_voice_en_137152,She walked across the street wearing stereo headphones and staring at her smartphone.,"She walked across the street, wearing stereo headphones and staring at her smartphone.",0.000000,0,0,0,13,5.0797,0.0000,True,
common_voice_en_13900-common_voice_en_13901,"Television can make you dumb, but it can also be good education.","Television can make you dumb, but it can also be good education.",0.000000,0,0,0,12,4.6133,0.0000,True,
common_voice_en_1416089-common_voice_en_1416090,"""Jellyfish can cause serious injuries"", the physician explained to the patient.","Jellyfish can cause serious injuries,"" the physician explained to the patient.",0.000000,0,0,0,11,4.4640,0.0000,True,
common_voice_en_1416089-common_voice_en_1416093,"""Jellyfish can cause serious injuries"", the physician explained to the patient.","Jellyfish can cause serious injuries,"" the physician explained to the patient.",0.000000,0,0,0,11,4.4640,0.0000,True,
common_voice_en_15265-common_voice_en_15266,Man with guitar holding a microphone in one hand and extending his other arm.,"Man with guitar, holding a microphone in one hand and extending his other arm.",0.000000,0,0,0,14,6.5520,0.0000,True,
common_voice_en_15265-common_voice_en_15268,Man with guitar holding a microphone in one hand and extending his other arm.,"Man with guitar, holding a microphone in one hand and extending his other arm.",0.000000,0,0,0,14,6.5520,0.0000,True,
common_voice_en_153872-common_voice_en_153873,"Hundreds must have seen it, and taken it for a falling star.",Hundreds must have seen it and taken it for a falling star.,0.000000,0,0,0,12,3.1680,0.0000,True,
common_voice_en_153872-common_voice_en_153874,"Hundreds must have seen it, and taken it for a falling star.","Hundreds must have seen it, and taken it for a falling star.",0.000000,0,0,0,12,3.1680,0.0000,True,
common_voice_en_155313-common_voice_en_155315,"Revenge is not my style, but obviously accidents will happen.","Revenge is not my style, but obviously accidents will happen.",0.000000,0,0,0,10,3.9791,0.0000,True,
common_voice_en_15734837-common_voice_en_15734838,I shall be neither more nor less meritorious.,I shall be neither more nor less meritorious.,0.000000,0,0,0,8,4.4355,0.0000,True,
common_voice_en_15735839-common_voice_en_15735837,She didn't like the trend of nylon stockings.,She didn't like the trend of nylon stockings.,0.000000,0,0,0,9,3.1627,0.0000,True,
common_voice_en_15903802-common_voice_en_15903807,Experts of geology agree: Yesterday's tsunami was just a herald of the imminent apocalypse.,Experts of geology agree. Yesterday's tsunami was just a herald of the imminent apocalypse.,0.000000,0,0,0,15,5.3547,0.0000,True,
common_voice_en_15903802-common_voice_en_15903815,Experts of geology agree: Yesterday's tsunami was just a herald of the imminent apocalypse.,Experts of geology agree. Yesterday's tsunami was just a herald of the imminent apocalypse.,0.000000,0,0,0,15,5.3547,0.0000,True,
common_voice_en_16666041-common_voice_en_16666040,"Birds feed their offspring with spiders, worms, slugs and bugs.","Birds feed their offspring with spiders, worms, slugs, and bugs.",0.000000,0,0,0,10,5.1520,0.0000,True,
common_voice_en_167249-common_voice_en_167246,Play the song from the genre Sunshine Reggae that appeals to me.,Play the song from the genre sunshine reggae that appeals to me.,0.000000,0,0,0,12,4.8853,0.0000,True,
common_voice_en_167249-common_voice_en_167247,Play the song from the genre Sunshine Reggae that appeals to me.,Play the song from the genre sunshine reggae that appeals to me.,0.000000,0,0,0,12,4.8853,0.0000,True,
common_voice_en_17147545-common_voice_en_17147546,It's probably a good idea to merge the two subsections in the synopsis.,It's probably a good idea to merge the two subsections in the synopsis.,0.000000,0,0,0,14,4.8320,0.0000,True,
common_voice_en_17161-common_voice_en_17159,"On the second day, the boy climbed to the top of a cliff near the camp.","On the second day, the boy climbed to the top of a cliff near the camp.",0.000000,0,0,0,16,4.1440,0.0000,True,
common_voice_en_17161-common_voice_en_17160,"On the second day, the boy climbed to the top of a cliff near the camp.","On the second day, the boy climbed to the top of a cliff near the camp.",0.000000,0,0,0,16,4.1440,0.0000,True,
common_voice_en_17249419-common_voice_en_17249428,"Using script blockers is generally a good idea, but it requires the user to learn a bit.","Using script blockers is generally a good idea, but it requires the user to learn a bit.",0.000000,0,0,0,17,5.6053,0.0000,True,
common_voice_en_17255102-common_voice_en_17255101,"I can reassure you, that we won't retreat until the oil until the peace is secured.",I can reassure you that we won't retreat until the oil until the peace is secured.,0.000000,0,0,0,17,6.1051,0.0000,True,
common_voice_en_17256676-common_voice_en_17256678,"Sometines, I need to clear my browser cache to save more storage space.",Sometimes I need to clear my browser cache to save more storage space.,0.076923,1,0,0,12,4.1814,0.0000,True,
common_voice_en_17259121-common_voice_en_17259122,"This part of the town was half residential, half industrial.","This part of the town was half residential, half industrial.",0.000000,0,0,0,10,5.1051,0.0000,True,
common_voice_en_17263752-common_voice_en_17263750,"After the prince had been rescued, he showed evidence of Stockholm syndrome.","After the prince had been rescued, he showed evidence of Stockholm syndrome.",0.000000,0,0,0,12,3.8133,0.0000,True,
common_voice_en_17263752-common_voice_en_17263755,"After the prince had been rescued, he showed evidence of Stockholm syndrome.","After the prince had been rescued, he showed evidence of Stockholm syndrome.",0.000000,0,0,0,12,3.8133,0.0000,True,
common_voice_en_17263780-common_voice_en_17263781,"Early to bed, early to rise, makes you healthy, wealthy & wise.","Early to bed, early to rise, makes you healthy, wealthy, and wise.",0.090909,0,0,1,11,4.3413,0.0000,True,
common_voice_en_17263780-common_voice_en_17263782,"Early to bed, early to rise, makes you healthy, wealthy & wise.","Early to bed, early to rise, makes you healthy, wealthy, and wise.",0.090909,0,0,1,11,4.3413,0.0000,True,
common_voice_en_17267923-common_voice_en_17267922,"I pressed the button for my nurse, but he did not come.","I pressed the button for my nurse, but he did not come.",0.000000,0,0,0,12,3.2000,0.0000,True,
common_voice_en_17268075-common_voice_en_17268076,"Pork cutlet is also very tasty, but our religion does not allow us to eat it.","Pork cutlet is also very tasty, but our religion does not allow us to eat it.",0.000000,0,0,0,16,3.9787,0.0000,True,
common_voice_en_17271507-common_voice_en_17271509,"Take this pill twice daily, once in the morning and once at bedtime.","Take this pill twice daily, once in the morning and once at bedtime.",0.000000,0,0,0,13,4.2507,0.0000,True,
common_voice_en_17271507-common_voice_en_17271510,"Take this pill twice daily, once in the morning and once at bedtime.","Take this pill twice daily, once in the morning and once at bedtime.",0.000000,0,0,0,13,4.2507,0.0000,True,
common_voice_en_17274522-common_voice_en_17274523,"Palm oil is cheap, but workers on illegal plantations get exploited and huge areas of jungle get destroyed for its production.","Palm oil is cheap, but workers on illegal plantations get exploited, and huge areas of jungle get destroyed for its production.",0.000000,0,0,0,21,6.8449,0.0000,True,
common_voice_en_17274522-common_voice_en_17274525,"Palm oil is cheap, but workers on illegal plantations get exploited and huge areas of jungle get destroyed for its production.","Palm oil is cheap, but workers on illegal plantations get exploited, and huge areas of jungle get destroyed for its production.",0.000000,0,0,0,21,6.8449,0.0000,True,
common_voice_en_17274533-common_voice_en_17274531,"She put on her slippers, scaled the stairs, and went to bed.","She put on her slippers, scaled the stairs, and went to bed.",0.000000,0,0,0,12,4.1067,0.0000,True,
common_voice_en_17275818-common_voice_en_17275816,They're trying to get people with vague ideas for projects to come together.,They're trying to get people with vague ideas for projects to come together.,0.000000,0,0,0,14,3.7760,0.0000,True,
common_voice_en_17275818-common_voice_en_17275817,They're trying to get people with vague ideas for projects to come together.,They're trying to get people with vague ideas for projects to come together.,0.000000,0,0,0,14,3.7760,0.0000,True,
common_voice_en_17277080-common_voice_en_17277082,"Salmon is one of the most popular fish and very delicious, though usually not sustainable.","Salmon is one of the most popular fish and very delicious, though usually not sustainable.",0.000000,0,0,0,15,5.8240,0.0000,True,
common_voice_en_17277080-common_voice_en_17277083,"Salmon is one of the most popular fish and very delicious, though usually not sustainable.","Salmon is one of the most popular fish and very delicious, though usually not sustainable.",0.000000,0,0,0,15,5.8240,0.0000,True,
common_voice_en_17278904-common_voice_en_17278905,"Valuable or not, if he becomes a liability, I'll be forced to clean up after you.","Valuable or not, if he becomes a liability, I'll be forced to clean up after you.",0.000000,0,0,0,17,5.9733,0.0000,True,
common_voice_en_17278904-common_voice_en_17278909,"Valuable or not, if he becomes a liability, I'll be forced to clean up after you.","Valuable or not, if he becomes a liability, I'll be forced to clean up after you.",0.000000,0,0,0,17,5.9733,0.0000,True,
common_voice_en_17281385-common_voice_en_17281386,The hotel gives some complimentary water bottles to drink.,The hotel gives some complimentary water bottles to drink.,0.000000,0,0,0,9,4.4309,0.0000,True,
common_voice_en_17281385-common_voice_en_17281393,The hotel gives some complimentary water bottles to drink.,The hotel gives some complimentary water bottles to drink.,0.000000,0,0,0,9,4.4309,0.0000,True,
common_voice_en_17288057-common_voice_en_17288056,"They both stormed out, neither thinking to fill me in on where they were going.",They both stormed out. Neither thinking to fill me in on where they were going.,0.000000,0,0,0,15,4.2273,0.0000,True,
common_voice_en_17288057-common_voice_en_17288059,"They both stormed out, neither thinking to fill me in on where they were going.",They both stormed out. Neither thinking to fill me in on where they were going.,0.000000,0,0,0,15,4.2273,0.0000,True,
common_voice_en_17324784-common_voice_en_17324785,Not everything that is faced can be changed; but nothing can be changed until it is faced.,"Not everything that is faced can be changed, but nothing can be changed until it is faced.",0.000000,0,0,0,17,5.3048,0.0000,True,
common_voice_en_17324784-common_voice_en_17324786,Not everything that is faced can be changed; but nothing can be changed until it is faced.,"Not everything that is faced can be changed, but nothing can be changed until it is faced.",0.000000,0,0,0,17,5.3048,0.0000,True,
common_voice_en_17347410-common_voice_en_17347409,"If possible, we'd like the papers a week before and after each of these dates please.","If possible, we'd like the papers a week before and after each of these dates, please.",0.000000,0,0,0,17,3.8689,0.0000,True,
common_voice_en_17352169-common_voice_en_17352173,"Mrs. Travis, when I leave my kids in kindergarten, I expect you to supervise them.","Mrs. Travis, when I leave my kids in kindergarten, I expect you to supervise them.",0.000000,0,0,0,15,7.8669,0.0000,True,
common_voice_en_173534-common_voice_en_173537,"Lions hunt their prey with sprints, whereas wolves take advantage of their stamina.","Lions hunt their prey with sprints, whereas wolves take advantage of their stamina.",0.000000,0,0,0,13,4.7893,0.0000,True,
common_voice_en_173534-common_voice_en_173540,"Lions hunt their prey with sprints, whereas wolves take advantage of their stamina.","Lions hunt their prey with sprints, whereas wolves take advantage of their stamina.",0.000000,0,0,0,13,4.7893,0.0000,True,
common_voice_en_17369337-common_voice_en_17369336,Curiosity killed the cat; Satisfaction brought it back.,Curiosity killed the cat. Satisfaction brought it back.,0.000000,0,0,0,8,4.2000,0.0000,True,
common_voice_en_17369851-common_voice_en_17369849,"It's a nice walk though, with trees and a river and stuff.","It's a nice walk, though, with trees and a river and stuff.",0.000000,0,0,0,13,4.7200,0.0000,True,
common_voice_en_17375252-common_voice_en_17375256,"Let it burn, it gives us warmth and comfort.",Let it burn. It gives us warmth and comfort.,0.000000,0,0,0,9,3.5051,0.0000,True,
common_voice_en_17380945-common_voice_en_17380947,Verify if the configuration file is valid.,Verify if the configuration file is valid.,0.000000,0,0,0,7,3.4059,0.0000,True,
common_voice_en_17389076-common_voice_en_17389120,"Kenneth reacted badly to the steroids, he's under observation for the next hour.",Kenneths reacted badly to the steroids. He's under observation for the next hour.,0.071429,1,0,0,13,4.7486,0.0000,True,
common_voice_en_17389984-common_voice_en_17389987,"She wasn't home, a neighbour said that he didn't think she came in last night.",She wasn't home. A neighbor said that he didn't think she came in last night.,0.000000,0,0,0,17,4.2133,0.0000,True,
common_voice_en_17389984-common_voice_en_17389988,"She wasn't home, a neighbour said that he didn't think she came in last night.",She wasn't home. A neighbor said that he didn't think she came in last night.,0.000000,0,0,0,17,4.2133,0.0000,True,
common_voice_en_17401431-common_voice_en_17401433,"Not specifically no, he only gave me the gist of his research the one time I spoke to him.","Not specifically. No, he only gave me the gist of his research the one time I spoke to him.",0.000000,0,0,0,19,4.9420,0.0000,True,
common_voice_en_17406452-common_voice_en_17406455,"The combination of trumpets, violins and a drum set is quite unusual.","The combination of trumpets, violins, and a drum set is quite unusual.",0.000000,0,0,0,12,4.0107,0.0000,True,
common_voice_en_17406452-common_voice_en_17406466,"The combination of trumpets, violins and a drum set is quite unusual.","The combination of trumpets, violins, and a drum set is quite unusual.",0.000000,0,0,0,12,4.0107,0.0000,True,
common_voice_en_17406732-common_voice_en_17406734,"The more you read, the better you will be understood.","The more you read, the better you will be understood.",0.000000,0,0,0,10,3.3264,0.0000,True,
common_voice_en_17406732-common_voice_en_17406735,"The more you read, the better you will be understood.","The more you read, the better you will be understood.",0.000000,0,0,0,10,3.3264,0.0000,True,
common_voice_en_17429166-common_voice_en_17429168,"When he was in hospital, the nurse took an x-ray photograph of his arm.","When he was in hospital, the nurse took an X-ray photograph of his arm.",0.000000,0,0,0,15,5.1051,0.0000,True,
common_voice_en_17429166-common_voice_en_17429171,"When he was in hospital, the nurse took an x-ray photograph of his arm.","When he was in hospital, the nurse took an X-ray photograph of his arm.",0.000000,0,0,0,15,5.1051,0.0000,True,
common_voice_en_17442686-common_voice_en_17442688,"""You're a good lad, you know?"" he told his son with stern eyes.","You're a good lad, you know,"" he told his son with stern eyes.",0.000000,0,0,0,14,3.3298,0.0000,True,
common_voice_en_17444666-common_voice_en_17444667,"Before we begin with the actual baptism, let's renew our creed.","Before we begin with the actual baptism, let's renew our creed.",0.000000,0,0,0,12,3.5200,0.0000,True,
common_voice_en_17444666-common_voice_en_17444668,"Before we begin with the actual baptism, let's renew our creed.","Before we begin with the actual baptism, let's renew our creed.",0.000000,0,0,0,12,3.5200,0.0000,True,
common_voice_en_17451108-common_voice_en_17451109,"Nora finds herself ugly, because she has pimples.",Nora finds herself ugly because she has pimples.,0.000000,0,0,0,8,3.7227,0.0000,True,
common_voice_en_17502-common_voice_en_17503,"Not only did he manage to do it, he did it professionally!","Not only did he manage to do it, he did it professionally.",0.000000,0,0,0,12,5.3813,0.0000,True,
common_voice_en_17519982-common_voice_en_17519985,"In general, people have difficulties estimating risks correctly.","In general, people have difficulties estimating risks correctly.",0.000000,0,0,0,8,4.5135,0.0000,True,
common_voice_en_17519982-common_voice_en_17519988,"In general, people have difficulties estimating risks correctly.","In general, people have difficulties estimating risks correctly.",0.000000,0,0,0,8,4.5135,0.0000,True,
common_voice_en_175348-common_voice_en_175349,That’s because I want to remove the old grout from the bathroom tile.,That's because I want to remove the old grout from the bathroom tile.,0.071429,1,0,0,13,4.1406,0.0000,True,
common_voice_en_175348-common_voice_en_175350,That’s because I want to remove the old grout from the bathroom tile.,That's because I want to remove the old grout from the bathroom tile.,0.071429,1,0,0,13,4.1406,0.0000,True,
common_voice_en_17578783-common_voice_en_17578780,"Check whether the website is funded by ads, donations, or others.","Check whether the website is funded by ads, donations, or others.",0.000000,0,0,0,11,3.7846,0.0000,True,
common_voice_en_17578783-common_voice_en_17578781,"Check whether the website is funded by ads, donations, or others.","Check whether the website is funded by ads, donations, or others.",0.000000,0,0,0,11,3.7846,0.0000,True,
common_voice_en_17662945-common_voice_en_17662954,"At the airport, the woman threw herself into revision for college so she could experience university.","At the airport, the woman threw herself into revision for college, so she could experience university.",0.000000,0,0,0,16,7.2213,0.0000,True,
common_voice_en_17662945-common_voice_en_17662956,"At the airport, the woman threw herself into revision for college so she could experience university.","At the airport, the woman threw herself into revision for college, so she could experience university.",0.000000,0,0,0,16,7.2213,0.0000,True,
common_voice_en_17718576-common_voice_en_17718578,"Since I've gotten a dog, the regular visits of the fox have stopped.","Since I've gotten a dog, the regular visits of the fox have stopped.",0.000000,0,0,0,14,3.5576,0.0000,True,
common_voice_en_17727889-common_voice_en_17727904,Such an oscillating dipole moment can exchange energy with an electromagnetic wave of same frequency.,Such an oscillating dipole moment can exchange energy with an electromagnetic wave of same frequency.,0.000000,0,0,0,15,6.8094,0.0000,True,
common_voice_en_17727889-common_voice_en_17727905,Such an oscillating dipole moment can exchange energy with an electromagnetic wave of same frequency.,Such an oscillating dipole moment can exchange energy with an electromagnetic wave of same frequency.,0.000000,0,0,0,15,6.8094,0.0000,True,
common_voice_en_17729945-common_voice_en_17729943,"Other energy sources receive subsidies as well, often much higher.","Other energy sources receive subsidies as well, often much higher.",0.000000,0,0,0,10,3.9869,0.0000,True,
common_voice_en_17729945-common_voice_en_17729944,"Other energy sources receive subsidies as well, often much higher.","Other energy sources receive subsidies as well, often much higher.",0.000000,0,0,0,10,3.9869,0.0000,True,
common_voice_en_17736608-common_voice_en_17736610,I was told by my instructor to use a nichrome wire to burn metal solids.,I was told by my instructor to use a nichrome wire to burn metal solids.,0.000000,0,0,0,15,5.8027,0.0000,True,
common_voice_en_17738848-common_voice_en_17744571,Might others within your organisation have some inkling as to their desires?,Might others within your organization have some inkling as to their desires?,0.000000,0,0,0,12,5.0518,0.0000,True,
common_voice_en_17738848-common_voice_en_19083939,Might others within your organisation have some inkling as to their desires?,Might others within your organization have some inkling as to their desires?,0.000000,0,0,0,12,5.0518,0.0000,True,
common_voice_en_17781154-common_voice_en_17781153,"Darling, could you grab me some throat candy down at the local chemist?","Darling, could you grab me some throat candy down at the local chemist?",0.000000,0,0,0,13,3.7173,0.0000,True,
common_voice_en_17784-common_voice_en_17785,Nobody knows how much ammunition the military has in its checkpoints.,Nobody knows how much ammunition the military has in its checkpoints.,0.000000,0,0,0,11,4.5227,0.0000,True,
common_voice_en_17784-common_voice_en_17786,Nobody knows how much ammunition the military has in its checkpoints.,Nobody knows how much ammunition the military has in its checkpoints.,0.000000,0,0,0,11,4.5227,0.0000,True,
common_voice_en_177895-common_voice_en_177894,Several people are walking out in the spotlight.,Several people are walking out in the spotlight.,0.000000,0,0,0,8,3.5840,0.0000,True,
common_voice_en_177895-common_voice_en_177898,Several people are walking out in the spotlight.,Several people are walking out in the spotlight.,0.000000,0,0,0,8,3.5840,0.0000,True,
common_voice_en_17817002-common_voice_en_17817003,"Two hundred years after founding, the town got the right to mint its own coin.","Two hundred years after founding, the town got the right to mint its own coin.",0.000000,0,0,0,14,4.3680,0.0000,True,
common_voice_en_17817002-common_voice_en_17817005,"Two hundred years after founding, the town got the right to mint its own coin.","Two hundred years after founding, the town got the right to mint its own coin.",0.000000,0,0,0,14,4.3680,0.0000,True,
common_voice_en_17830764-common_voice_en_17830762,Fortunately its not the sole driving factor of the local economy.,"Fortunately, it's not the sole driving factor of the local economy.",0.181818,1,0,1,10,4.0140,0.0000,True,
common_voice_en_17830764-common_voice_en_17830783,Fortunately its not the sole driving factor of the local economy.,"Fortunately, it's not the sole driving factor of the local economy.",0.181818,1,0,1,10,4.0140,0.0000,True,
