id,target_text,whisper_text,wer,substitutions,deletions,insertions,hits,audio_duration_s,latency_s,is_success,error
common_voice_en_19176854-common_voice_en_19176853,"The town was first named Palmetto Home, after a nearby plantation.",The town was first named Palmetto Home after a nearby plantation.,0.000000,0,0,0,11,4.6611,0.0000,True,
common_voice_en_19176854-common_voice_en_19176856,"The town was first named Palmetto Home, after a nearby plantation.",The town was first named Palmetto Home after a nearby plantation.,0.000000,0,0,0,11,4.6611,0.0000,True,
common_voice_en_19211875-common_voice_en_19211870,"These contributions have resulted in improved correctness, performance, and reliability of computer systems.","These contributions have resulted in improved correctness, performance, and reliability of computer systems.",0.000000,0,0,0,13,8.8053,0.0000,True,
common_voice_en_19254683-common_voice_en_19254685,In the banking environment at that time the merger was inevitable.,"In the banking environment at that time, the merger was inevitable.",0.000000,0,0,0,11,3.3051,0.0000,True,
common_voice_en_19254683-common_voice_en_19254687,In the banking environment at that time the merger was inevitable.,"In the banking environment at that time, the merger was inevitable.",0.000000,0,0,0,11,3.3051,0.0000,True,
common_voice_en_19277026-common_voice_en_19277029,"Since its inception, the committee has met at least once a year.","Since its inception, the committee has met at least once a year.",0.000000,0,0,0,12,3.5360,0.0000,True,
common_voice_en_19284142-common_voice_en_19284143,The expression is now generally used metaphorically.,The expression is now generally used metaphorically.,0.000000,0,0,0,7,3.6694,0.0000,True,
common_voice_en_19284142-common_voice_en_19284144,The expression is now generally used metaphorically.,The expression is now generally used metaphorically.,0.000000,0,0,0,7,3.6694,0.0000,True,
common_voice_en_19289713-common_voice_en_19289715,This fee covers accident insurance and other administrative costs.,This fee covers accident insurance and other administrative costs.,0.000000,0,0,0,9,3.3920,0.0000,True,
common_voice_en_19294198-common_voice_en_19294199,These are used by players as well to interpret the characteristics of individual games.,These are used by players as well to interpret the characteristics of individual games.,0.000000,0,0,0,14,4.3733,0.0000,True,
common_voice_en_19294198-common_voice_en_19294200,These are used by players as well to interpret the characteristics of individual games.,These are used by players as well to interpret the characteristics of individual games.,0.000000,0,0,0,14,4.3733,0.0000,True,
common_voice_en_19343495-common_voice_en_19343496,The early industries included lumbering and maple syrup preparation.,The early industries included lumbering and maple syrup preparation.,0.000000,0,0,0,9,4.5440,0.0000,True,
common_voice_en_19343495-common_voice_en_19343497,The early industries included lumbering and maple syrup preparation.,The early industries included lumbering and maple syrup preparation.,0.000000,0,0,0,9,4.5440,0.0000,True,
common_voice_en_19345360-common_voice_en_19345358,"Like his predecessors, Cyrus had to recognize Median overlordship.","Like his predecessors, Cyrus had to recognize Median overlordship.",0.000000,0,0,0,9,5.2110,0.0000,True,
common_voice_en_19345360-common_voice_en_19345359,"Like his predecessors, Cyrus had to recognize Median overlordship.","Like his predecessors, Cyrus had to recognize Median overlordship.",0.000000,0,0,0,9,5.2110,0.0000,True,
common_voice_en_19361636-common_voice_en_19361634,"Kelty also has a modern community centre, and a modern library.",Kelty also has a modern community center and a modern library.,0.000000,0,0,0,11,3.8923,0.0000,True,
common_voice_en_19361636-common_voice_en_19361635,"Kelty also has a modern community centre, and a modern library.",Kelty also has a modern community center and a modern library.,0.000000,0,0,0,11,3.8923,0.0000,True,
common_voice_en_19384720-common_voice_en_19384721,"The high altitude serves to cool the climate, which would otherwise be very hot.","The high altitude serves to cool the climate, which would otherwise be very hot.",0.000000,0,0,0,14,4.7515,0.0000,True,
common_voice_en_19397397-common_voice_en_19397399,The Knights conquered the Prussians and converted them to Christianity.,The knights conquered the Prussians and converted them to Christianity.,0.000000,0,0,0,10,3.5225,0.0000,True,
common_voice_en_19397397-common_voice_en_19397407,The Knights conquered the Prussians and converted them to Christianity.,The knights conquered the Prussians and converted them to Christianity.,0.000000,0,0,0,10,3.5225,0.0000,True,
common_voice_en_19401124-common_voice_en_19401123,The Harrah's brand would remain one of the company's three primary casino brands.,The Hera's brand would remain one of the company's three primary casino brands.,0.066667,1,0,0,14,4.8480,0.0000,True,
common_voice_en_19401124-common_voice_en_19401125,The Harrah's brand would remain one of the company's three primary casino brands.,The Hera's brand would remain one of the company's three primary casino brands.,0.066667,1,0,0,14,4.8480,0.0000,True,
common_voice_en_19428391-common_voice_en_19428392,They would be indicted on federal charges of bid rigging to get government contracts.,They would be indicted on federal charges of bid rigging to get government contracts.,0.000000,0,0,0,14,5.8560,0.0000,True,
common_voice_en_19428391-common_voice_en_19428396,They would be indicted on federal charges of bid rigging to get government contracts.,They would be indicted on federal charges of bid rigging to get government contracts.,0.000000,0,0,0,14,5.8560,0.0000,True,
common_voice_en_19449066-common_voice_en_19449075,Mammals can only synthesize ten of the twenty standard amino acids.,Mammals can only synthesize ten of the twenty standard amino acids.,0.000000,0,0,0,11,5.0133,0.0000,True,
common_voice_en_19449066-common_voice_en_19449076,Mammals can only synthesize ten of the twenty standard amino acids.,Mammals can only synthesize ten of the twenty standard amino acids.,0.000000,0,0,0,11,5.0133,0.0000,True,
common_voice_en_19455206-common_voice_en_19455208,This was the first such general strike in the United States.,This was the first such general strike in the United States.,0.000000,0,0,0,11,4.1387,0.0000,True,
common_voice_en_19455206-common_voice_en_19455210,This was the first such general strike in the United States.,This was the first such general strike in the United States.,0.000000,0,0,0,11,4.1387,0.0000,True,
common_voice_en_19481268-common_voice_en_19481267,"As mining yields and economics changed, the railroads became less viable.","As mining yields and economics changed, the railroads became less viable.",0.000000,0,0,0,11,4.7573,0.0000,True,
common_voice_en_19481268-common_voice_en_19481270,"As mining yields and economics changed, the railroads became less viable.","As mining yields and economics changed, the railroads became less viable.",0.000000,0,0,0,11,4.7573,0.0000,True,
common_voice_en_19496235-common_voice_en_19496229,Netherlands and Spain have signed but not ratified the treaty.,Netherlands and Spain have signed but not ratified the treaty.,0.000000,0,0,0,10,4.0590,0.0000,True,
common_voice_en_19496235-common_voice_en_19496266,Netherlands and Spain have signed but not ratified the treaty.,Netherlands and Spain have signed but not ratified the treaty.,0.000000,0,0,0,10,4.0590,0.0000,True,
common_voice_en_19517720-common_voice_en_19517721,A microbiologist's work is often repeated or improved in order to establish accurate research.,A microbiologist's work is often repeated or improved in order to establish accurate research.,0.000000,0,0,0,15,5.4241,0.0000,True,
common_voice_en_19527999-common_voice_en_19528000,He gave them another choice: to hand over the informant.,He gave them another choice: to hand over the informant.,0.000000,0,0,0,10,3.2533,0.0000,True,
common_voice_en_19527999-common_voice_en_19528002,He gave them another choice: to hand over the informant.,"He gave them another choice, to hand over the informant.",0.000000,0,0,0,10,3.2533,0.0000,True,
common_voice_en_19531363-common_voice_en_19531364,Innocent went on to preside over the Second Lateran council.,Innocent went on to preside over the second Lateran Council.,0.000000,0,0,0,10,3.9744,0.0000,True,
common_voice_en_19540120-common_voice_en_19540122,Activation typically spreads to all the other units connected to it.,Activation typically spreads to all the other units connected to it.,0.000000,0,0,0,11,3.5510,0.0000,True,
common_voice_en_19560742-common_voice_en_19560741,The town is adjacent to and borders the city of Amsterdam on three sides.,The town is adjacent to and borders the city of Amsterdam on three sides.,0.000000,0,0,0,14,6.1440,0.0000,True,
common_voice_en_19560742-common_voice_en_19560749,The town is adjacent to and borders the city of Amsterdam on three sides.,"The town is adjacent to, and borders, the city of Amsterdam on three sides.",0.000000,0,0,0,14,6.1440,0.0000,True,
common_voice_en_19579295-common_voice_en_19579294,Mullan was a schoolboy witness of the events of Bloody Sunday.,Mullen was a schoolboy witness of the events of Bloody Sunday.,0.090909,1,0,0,10,4.7947,0.0000,True,
common_voice_en_19579295-common_voice_en_19579310,Mullan was a schoolboy witness of the events of Bloody Sunday.,Mullen was a schoolboy witness of the events of Bloody Sunday.,0.090909,1,0,0,10,4.7947,0.0000,True,
common_voice_en_19599129-common_voice_en_19599130,"He replaced the bass with a new one, as well as his girlfriend.","He replaced the bass with a new one, as well as his girlfriend.",0.000000,0,0,0,13,4.0326,0.0000,True,
common_voice_en_19602798-common_voice_en_19602797,"Betty Cooper helps Archie with cleaning a store room, when Reggie attacks her.",Betty Cooper helps Archie with cleaning a storeroom when Reggie attacks her.,0.153846,1,1,0,11,4.3147,0.0000,True,
common_voice_en_19608801-common_voice_en_19608806,Much of the commune is urbanised with some areas of forest and meadows.,"Much of the commune is urbanized, with some areas of forest and meadows.",0.000000,0,0,0,13,5.1413,0.0000,True,
common_voice_en_19619551-common_voice_en_19619549,Being raised stereotypically British includes belief in the philosophy: What would the neighbours think?,"Being raised stereotypically British includes belief in the philosophy: ""What would the neighbors think?""",0.000000,0,0,0,14,6.4208,0.0000,True,
common_voice_en_19619551-common_voice_en_19619550,Being raised stereotypically British includes belief in the philosophy: What would the neighbours think?,Being raised stereotypically British includes belief in the philosophy. What would the neighbours think?,0.000000,0,0,0,14,6.4208,0.0000,True,
common_voice_en_19619855-common_voice_en_19619858,The east terrace would also have a roof added as part of this development.,The east terrace would also have a roof added as a part of this development.,0.071429,0,0,1,14,7.1051,0.0000,True,
common_voice_en_19622969-common_voice_en_19622970,"The woman kisses his head and says, Happy Halloween dear.","The woman kisses his head and says, ""Happy Halloween, dear.""",0.000000,0,0,0,10,4.0053,0.0000,True,
common_voice_en_19622969-common_voice_en_19622971,"The woman kisses his head and says, Happy Halloween dear.","The woman kisses his head and says, ""Happy Halloween, dear.""",0.000000,0,0,0,10,4.0053,0.0000,True,
common_voice_en_19629167-common_voice_en_19629165,Watamu is a small fishing community and East Africa's first Marine National Park.,"Wetamu is a small fishing community, and East Africa's first marine national park.",0.071429,1,0,0,13,6.5089,0.0000,True,
common_voice_en_19629167-common_voice_en_19629166,Watamu is a small fishing community and East Africa's first Marine National Park.,"Wetamu is a small fishing community, and East Africa's first marine national park.",0.071429,1,0,0,13,6.5089,0.0000,True,
common_voice_en_19632634-common_voice_en_19632638,The stone is heated in a fire or in embers.,The stone is heated in a fire or in embers.,0.000000,0,0,0,10,3.3755,0.0000,True,
common_voice_en_19632634-common_voice_en_19632644,The stone is heated in a fire or in embers.,The stone is heated in a fire or in embers.,0.000000,0,0,0,10,3.3755,0.0000,True,
common_voice_en_19635046-common_voice_en_19635047,"They are perhaps most known for ""The Quill"" and the later ""Professional Adventure Writer"".",They are perhaps most known for the Quill and later professional adventure writer.,0.071429,0,1,0,13,6.6051,0.0000,True,
common_voice_en_19635046-common_voice_en_19635048,"They are perhaps most known for ""The Quill"" and the later ""Professional Adventure Writer"".","They are perhaps most known for the quill, and later, professional adventure writer.",0.071429,0,1,0,13,6.6051,0.0000,True,
common_voice_en_19636954-common_voice_en_19636955,"She continued drawing the lace with slow, dignified movements.","She continued drawing the lace with slow, dignified movements.",0.000000,0,0,0,9,3.9360,0.0000,True,
common_voice_en_19638442-common_voice_en_19638444,"The theme song ""Because of You"" was written and performed by Dexys Midnight Runners.","The theme song ""Because of You"" was written and performed by Daxie's Midnight Runners.",0.142857,1,0,1,13,5.6051,0.0000,True,
common_voice_en_19638442-common_voice_en_19638447,"The theme song ""Because of You"" was written and performed by Dexys Midnight Runners.","The theme song ""Because of You"" was written and performed by Dexie's Midnight Runners.",0.142857,1,0,1,13,5.6051,0.0000,True,
common_voice_en_19640906-common_voice_en_19640909,With this win Levet became the leading Frenchman in terms of European Tour wins.,"With this win, Levet became the leading Frenchman in terms of European Tour wins.",0.000000,0,0,0,14,5.4274,0.0000,True,
common_voice_en_19641039-common_voice_en_19641037,Drills and grinders often include this feature for added control.,Drills and grinders often include this feature for added control.,0.000000,0,0,0,10,5.2009,0.0000,True,
common_voice_en_19641039-common_voice_en_19641038,Drills and grinders often include this feature for added control.,Drills and grinders often include this feature for added control.,0.000000,0,0,0,10,5.2009,0.0000,True,
common_voice_en_19641789-common_voice_en_19641784,"When a certain length of time passes, he heads for the palace.","When a certain length of time passes, he heads for the palace.",0.000000,0,0,0,12,4.2702,0.0000,True,
common_voice_en_19641789-common_voice_en_19641791,"When a certain length of time passes, he heads for the palace.","When a certain length of time passes, he heads for the palace.",0.000000,0,0,0,12,4.2702,0.0000,True,
common_voice_en_19656513-common_voice_en_19656518,This large sea duck is characterised by its bulky shape and large bill.,This large sea duck is characterized by its bulky shape and large bill.,0.000000,0,0,0,13,4.1642,0.0000,True,
common_voice_en_19656513-common_voice_en_19656571,This large sea duck is characterised by its bulky shape and large bill.,This large sea duck is characterized by its bulky shape and large bill.,0.000000,0,0,0,13,4.1642,0.0000,True,
common_voice_en_19665909-common_voice_en_19665910,"The body ""pushes"" the air down, and the air pushes the body upward.","The body pushes the air down, and the air pushes the body upward.",0.000000,0,0,0,13,5.3874,0.0000,True,
common_voice_en_19665909-common_voice_en_19665911,"The body ""pushes"" the air down, and the air pushes the body upward.","The body pushes the air down, and the air pushes the body upward.",0.000000,0,0,0,13,5.3874,0.0000,True,
common_voice_en_19669708-common_voice_en_19669702,The name of the new Association was left until all other matters were decided.,The name of the new association was left until all other matters were decided.,0.000000,0,0,0,14,4.6229,0.0000,True,
common_voice_en_19669708-common_voice_en_19669704,The name of the new Association was left until all other matters were decided.,The name of the new association was left until all other matters were decided.,0.000000,0,0,0,14,4.6229,0.0000,True,
common_voice_en_19670166-common_voice_en_19670165,He is also a Patron of Creativity Australia.,He is also a patron of Creativity Australia.,0.000000,0,0,0,8,4.2804,0.0000,True,
common_voice_en_19670674-common_voice_en_19670675,"At the time, their proximity was considered proof that some dinosaurs were herd animals.","At the time, their proximity was considered proof that some dinosaurs were herd animals.",0.000000,0,0,0,14,5.2814,0.0000,True,
common_voice_en_19670674-common_voice_en_19670676,"At the time, their proximity was considered proof that some dinosaurs were herd animals.","At the time, their proximity was considered proof that some dinosaurs were herd animals.",0.000000,0,0,0,14,5.2814,0.0000,True,
common_voice_en_19671290-common_voice_en_19671292,The band also made its first appearance at the Boston Saint Patrick's Day Parade.,The band also made its first appearance at the Boston Saint Patrick's Day parade.,0.000000,0,0,0,15,5.3552,0.0000,True,
common_voice_en_19671290-common_voice_en_19671293,The band also made its first appearance at the Boston Saint Patrick's Day Parade.,The band also made its first appearance at the Boston St. Patrick's Day Parade.,0.000000,0,0,0,15,5.3552,0.0000,True,
common_voice_en_19686152-common_voice_en_19686154,Never have I seen so varied a country so suitable to cultivation.,"Never have I seen so varied a country, so suitable to cultivation.",0.000000,0,0,0,12,5.3425,0.0000,True,
common_voice_en_19686493-common_voice_en_19686494,He is currently employed as a political consultant.,He is currently employed as a political consultant.,0.000000,0,0,0,8,3.4347,0.0000,True,
common_voice_en_19686493-common_voice_en_19686496,He is currently employed as a political consultant.,He is currently employed as a political consultant.,0.000000,0,0,0,8,3.4347,0.0000,True,
common_voice_en_19690002-common_voice_en_19690001,A subsequent view of the scene shows something not viewed before.,A subsequent view of the scene shows something not viewed before.,0.000000,0,0,0,11,5.2249,0.0000,True,
common_voice_en_19690002-common_voice_en_19690003,A subsequent view of the scene shows something not viewed before.,A subsequent view of the scene shows something not viewed before.,0.000000,0,0,0,11,5.2249,0.0000,True,
common_voice_en_19691556-common_voice_en_19691557,Each category had tips for writing enjoyable games in that genre.,Each category had tips for writing enjoyable games in that genre.,0.000000,0,0,0,11,4.9810,0.0000,True,
common_voice_en_19691845-common_voice_en_19691840,Remember to report all problems and safety issues to you range master.,Remember to report all problems and safety issues to your range master.,0.083333,1,0,0,11,4.1813,0.0000,True,
common_voice_en_19691845-common_voice_en_19691884,Remember to report all problems and safety issues to you range master.,Remember to report all problems and safety issues to your range master.,0.083333,1,0,0,11,4.1813,0.0000,True,
common_voice_en_19692939-common_voice_en_19693060,It was a gymnastics class that initially drew his attention to dance early on.,It was a gymnastics class that initially drew his attention to dance. Only on.,0.071429,1,0,0,13,4.6051,0.0000,True,
common_voice_en_19695366-common_voice_en_19695364,Each collar bears red bendlets from the arms of the Byrons.,Each collar bears red bandlets from the arms of the Bayrains.,0.181818,2,0,0,9,4.8213,0.0000,True,
common_voice_en_19698719-common_voice_en_19698716,The second for no better reason than the first.,"The second, for no better reason than the first.",0.000000,0,0,0,9,3.1733,0.0000,True,
common_voice_en_19698719-common_voice_en_19698718,The second for no better reason than the first.,"The second, for no better reason than the first.",0.000000,0,0,0,9,3.1733,0.0000,True,
common_voice_en_19701583-common_voice_en_19701587,"There are also two lodges, and of land.",There are also two lodges and of land.,0.000000,0,0,0,8,3.4296,0.0000,True,
common_voice_en_19701583-common_voice_en_19701588,"There are also two lodges, and of land.",There are also two lodges and of land.,0.000000,0,0,0,8,3.4296,0.0000,True,
common_voice_en_19706873-common_voice_en_19706870,Remains of Roman settlement have been uncovered in the area.,Remains of Roman settlements have been uncovered in the area.,0.100000,1,0,0,9,3.3387,0.0000,True,
common_voice_en_19714465-common_voice_en_19714469,"He was seen as an idealistic, but also polarizing politician.","He was seen as an idealistic, but also polarizing, politician.",0.000000,0,0,0,10,5.2373,0.0000,True,
common_voice_en_19717736-common_voice_en_19717739,A sizeable number of witnesses were deposed under oath to testify before the Commission.,A considerable number of witnesses were deposed under oath to testify before the commission.,0.071429,1,0,0,13,5.8933,0.0000,True,
common_voice_en_19722359-common_voice_en_19722362,A hundred spectators had gathered around the amphitheater to witness the impressive scene.,A hundred spectators had gathered around the amphitheatre to witness the impressive scene.,0.000000,0,0,0,13,5.6051,0.0000,True,
common_voice_en_19722359-common_voice_en_19722397,A hundred spectators had gathered around the amphitheater to witness the impressive scene.,A hundred spectators had gathered around the amphitheatre to witness the impressive scene.,0.000000,0,0,0,13,5.6051,0.0000,True,
common_voice_en_19724030-common_voice_en_19724028,Gum arabic is used primarily in the food industry as a stabilizer.,Gum arabic is used primarily in the food industry as a stabilizer.,0.000000,0,0,0,12,4.9426,0.0000,True,
common_voice_en_19724030-common_voice_en_19724029,Gum arabic is used primarily in the food industry as a stabilizer.,Gum arabic is used primarily in the food industry as a stabilizer.,0.000000,0,0,0,12,4.9426,0.0000,True,
common_voice_en_19724242-common_voice_en_19724243,"Diemen is located in the province North Holland, in the west of the Netherlands.","Diemen is located in the province North Holland, in the west of the Netherlands.",0.000000,0,0,0,14,4.7013,0.0000,True,
common_voice_en_19724242-common_voice_en_19724245,"Diemen is located in the province North Holland, in the west of the Netherlands.","Deemden is located in the province North Holland, in the west of the Netherlands.",0.071429,1,0,0,13,4.7013,0.0000,True,
common_voice_en_19724475-common_voice_en_19724484,Mitchell Stevens has published a small mini-series magazine entitled How idle are you?,"Mitchell Stevens has published a small miniseries magazine entitled ""How Idle Are You.""",0.142857,1,1,0,12,6.1051,0.0000,True,
common_voice_en_19724850-common_voice_en_19724899,"The Inca tern feeds primarily on small fish, such as anchovies.","The Inca tern feeds primarily on small fish, such as anchovies.",0.000000,0,0,0,11,4.3282,0.0000,True,
common_voice_en_19724850-common_voice_en_19724900,"The Inca tern feeds primarily on small fish, such as anchovies.","The Inca turn feeds primarily on small fish, such as anchovies.",0.090909,1,0,0,10,4.3282,0.0000,True,
common_voice_en_19726989-common_voice_en_19726988,"The accident is featured on the Discovery Channel series ""Destroyed in Seconds"".",The accident is featured on the Discovery Channel series Destroyed in Seconds.,0.000000,0,0,0,12,5.2960,0.0000,True,
common_voice_en_19726989-common_voice_en_19726990,"The accident is featured on the Discovery Channel series ""Destroyed in Seconds"".","The accident is featured on the Discovery Channel series ""Destroyed in Seconds.""",0.000000,0,0,0,12,5.2960,0.0000,True,
common_voice_en_19727183-common_voice_en_19727184,"The strings are never pressed to the neck, giving a harmonic and unique sound.","The strings are never pressed to the neck, giving a harmonic and unique sound.",0.000000,0,0,0,14,6.1493,0.0000,True,
common_voice_en_19727183-common_voice_en_19727187,"The strings are never pressed to the neck, giving a harmonic and unique sound.","The strings are never pressed to the neck, giving a harmonic and unique sound.",0.000000,0,0,0,14,6.1493,0.0000,True,
common_voice_en_19729972-common_voice_en_19729973,"The nature reserve is visible, but not open to the public.","The natural reserve is visible, but not open to the public.",0.090909,1,0,0,10,4.1508,0.0000,True,
common_voice_en_19729972-common_voice_en_19729975,"The nature reserve is visible, but not open to the public.","The natural reserve is visible, but not open to the public.",0.090909,1,0,0,10,4.1508,0.0000,True,
common_voice_en_19730681-common_voice_en_19730680,"The liquor was first created as ""Brandy Milk"", produced with milk, brandy and vanilla.","The liquor was first created as brandy milk, produced with milk, brandy, and vanilla.",0.000000,0,0,0,14,5.0375,0.0000,True,
common_voice_en_19730681-common_voice_en_19730683,"The liquor was first created as ""Brandy Milk"", produced with milk, brandy and vanilla.","The liquor was first created as brandy milk, produced with milk, brandy, and vanilla.",0.000000,0,0,0,14,5.0375,0.0000,True,
common_voice_en_19733143-common_voice_en_19733141,"From that point, Kimura was only capable of delaying actions.","From that point, Chimra was only capable of delaying actions.",0.100000,1,0,0,9,4.0853,0.0000,True,
common_voice_en_19734247-common_voice_en_19734251,They mopped up remaining pockets of resistance in these areas in small unit actions.,They mopped up remaining pockets of resistance in these areas in small unit actions.,0.000000,0,0,0,14,5.7759,0.0000,True,
